{
  "$schema": "../schemas/objective.schema.json",
  "name": {
    "en": "Comfortable basics",
    "fr": "Besoins vitaux assurés"
  },
  "description": {
    "en": "Keep the Vital Need level satisfied.",
    "fr": "Maintenir le niveau de besoin vital satisfait."
  },
  "metric": "vitalSatisfaction",
  "target": 70,
  "holdDays": 3,
  "grant": 300,
  "unlockCitizens": 20
}
